{
  "verb": "fetch",
  "version": "1.1.0",
  "status": "ok",
  "timestamp": "2026-03-18T12:00:00Z",
  "agent": "fetchagent.eth",
  "request_hash": "sha256:b187a51f7d7bb231daa603efd3a43ed46e85a64d670723f9ea2176c960d11ee1",
  "result_hash": "sha256:91a30e81d19f6392ec15eabfb63e8658a3e52a41ee01c7c3a9adcb75e560239a",
  "result_cid": "bafybeid9q2w4x6c8v1b3n5m7k9j2h4g6f8d1s3a5p7o9i2u4y6t8r1e3w5",
  "summary": "Fetched a JSON status document describing service health, schema tag, and signer availability.",
  "signature": "eyJhbGciOiJFZERTQSIsImtpZCI6ImRpZDpleGFtcGxlOmNvbW1vbnMjdjEuMS4wIn1fZXlKaGMzTWlPaUpqYjIxdFlXNWtiR0Y1WlhJdVpYUm9JbjBfcTgzUXhKOGRabDFzUjVuVjdtSzJwVDR5SDZ1VzljQjNhRTVnSjdkTDluUA"
}
